{
  "id": "art_5d0e17",
  "media_type": "video/mp4",
  "bytes": 10485760,
  "sha256": "e3b98a4da31a127d4bde6e43033f66ba274cab0eb7eb1c70ec41402bf6273dd8",
  "created_at": "2026-10-23T08:00:00Z",
  "expires_at": "2026-10-30T08:00:00Z",
  "metadata": { "width": 1280, "height": 720, "duration_ms": 5000, "audio": true }
}
